{
  "v": 1,
  "content": "# Claude MCP\n\nUse TREF directly from Claude Code with the MCP server.\n\n## Install\n\n```\nclaude mcp add tref -- tref-mcp\n```\n\n## Available tools\n\n- tref_publish - Create a new block\n- tref_derive - Derive from parent\n- tref_validate - Check block integrity\n- tref_list - List all blocks\n- tref_info - Get block metadata\n- tref_cat - Read block content",
  "meta": {
    "created": "2026-01-07T17:49:01.327Z",
    "license": "CC-BY-4.0",
    "author": "TREF Documentation"
  },
  "refs": [
    {
      "type": "url",
      "url": "https://tref.lpmwfx.com/mcp.html",
      "title": "Claude MCP"
    }
  ],
  "id": "sha256:7a42f62c04740baf6831e14f73d0ccc1f69a49a781219075820895b70bf8e0ed"
}