{
  "v": 1,
  "id": "sha256:2d576f7582ac8555f6086710ea6a79d734c762caff8443ccd752d80c524d3f6c",
  "content": "# CLI Reference\n\nCommand-line tools for creating and managing TREF blocks.\n\n## Quick Start\n\n### Install\n\nDownload and install the TREF CLI tool.\n\n```\ncurl -sSL https://tref.lpmwfx.com/install.sh | bash\n```\n\n### Create a block\n\nPublish your first TREF block from the command line.\n\n```\ntref publish \"The speed of light is 299,792,458 m/s\"\n```\n\n### Add references\n\nInclude source URLs for verifiability.\n\n```\ntref publish \"Fact here\" --refs '[{\"type\":\"url\",\"url\":\"https://source.com\"}]'\n```\n\n### Derive from existing\n\nCreate a new block based on an existing one, preserving lineage.\n\n```\ntref derive sha256:abc123... \"Updated content with corrections\"\n```\n\n## Commands\n\n### tref publish\n\nCreate a new TREF block.\n\n```\ntref publish \"content\"\ntref publish -f file.md\necho \"content\" | tref publish --stdin\ntref publish \"content\" --refs '[...]' --license CC-BY-4.0\n```\n\n### tref derive\n\nCreate a child block from a parent, preserving lineage.\n\n```\ntref derive <parent-id> \"new content\"\ntref derive sha256:abc... \"Updated\" --refs '[{\"type\":\"url\",\"url\":\"...\"}]'\n```\n\n### tref validate\n\nVerify a block's integrity (ID matches content hash).\n\n```\ntref validate block.tref\ntref validate published/ab/abc123...def.tref\n```\n\n### tref list / info / cat\n\nBrowse and read published blocks.\n\n```\ntref list                    # List all blocks\ntref info sha256:abc...      # Show metadata\ntref cat sha256:abc...       # Output content\ntref cat sha256:abc... --format json\n```",
  "meta": {
    "created": "2026-01-08T20:18:04.498Z",
    "license": "CC-BY-4.0",
    "author": "TREF Documentation"
  },
  "refs": [
    {
      "type": "url",
      "url": "https://tref.lpmwfx.com/cli.html",
      "title": "CLI Reference"
    }
  ]
}